{
  "schema_version": "1.0.0",
  "id": "id-example-0001",
  "task_id": "task_id-example-0001",
  "run_id": "run_id-example-0001",
  "status": "completed",
  "created_at": "2026-07-26T12:00:00Z",
  "safe_summary": "safe_summary-example-0001",
  "claims": [
    {
      "schema_version": "1.0.0",
      "id": "id-example-0001",
      "text": "The example claim is supported by the cited source.",
      "claim_type": "direct_evidence",
      "supporting_evidence_ids": [],
      "contradicting_evidence_ids": [],
      "calculation_artifact_ids": [],
      "as_of": "2026-07-26T12:00:00Z"
    }
  ],
  "artifacts": [
    {
      "schema_version": "1.0.0",
      "id": "id-example-0001",
      "kind": "document",
      "uri": "https://example.org/artifact",
      "digest": "sha256:aaaaaaaaaaaaaaaaaaaaaaaaaaaaaaaaaaaaaaaaaaaaaaaaaaaaaaaaaaaaaaaa",
      "classification": "public",
      "created_at": "2026-07-26T12:00:00Z",
      "source_system": "source_system-example-0001"
    }
  ],
  "limitations": [],
  "trace_id": "trace_id-example-0001"
}
